0	"Einfach mal bequem nicht ankommen"	"Die Deutsche Bahn versüßt das Warten"	www.bahn.de	0	0	na	old
1	"Muttertag vergessen?"	"Hier finden Sie Blumen für jeden Geschmack"	www.blume2000.de	0	0	male	na
2	"Hardware for Geeks"	"Die neuesten Gadgets für 1337 Haxxor"	www.gadget.org	0	0	na	teen,young
3	"Computer für Kinder"	"Auch ohne Hirn bedienbar"	www.apple.de	0	0	na	teen,young
4	"Innovative Ideen"	"Lehrstuhl RVS Uni Leipzig sorgt für Fortschritt"	rvs.informatik.uni-leipzig.de	0	0	na	na
5	"Tipps für Abschlussarbeiten"	"Vorlagen und Hinweise zu Plagiaten"	www.guttenplag.de	0	0	na	young,old
6	"Notebooks für die Ewigkeit"	"Neue Thinkpad-Serie verfügbar. Jetzt bestellen"	www.lenovo.de	0	0	na	na
